"title","stars","text","publishedAtDate","name","reviewerNumberOfReviews","isLocalGuide","reviewUrl","reviewerUrl","responseFromOwnerText","responseFromOwnerDate","originalLanguage","likesCount","visitedIn"
"Restaurante Parrilla Maravilla","3","Fuimos a cenar un jueves a la noche con mi familia, en el patio. El lugar es muy lindo y tiene buena energía.

Nuestra mesa se tambaleaba; pedí si la podían ajustar y muy amablemente vinieron a nivelarla. Quizás estaría bueno que revisen todas las mesas antes del servicio.

La variedad de vinos es muy buena y el asesoramiento también, en la línea de lo que sucede en Lardito.

El volumen de la música estaba bastante alto, incluso estando en una mesa del fondo donde no había parlantes cerca. Por eso no estoy seguro de si es un lugar pensado para ir con familia de noche; quizás al mediodía tenga otro clima.

El servicio fue correcto pero algo ausente. La camarera pasó pocas veces por la mesa y en un momento me tuve que levantar para pedir más agua. Tal vez era porque estábamos en el fondo o porque había poco personal.

Ahora sí, la comida: muy rica.
Pedimos dumplings y buffalo wings de entrada, ambas muy buenas.

De carnes:
•	Marucha: muy rica de sabor, aunque no tan tierna.
•	Asado banderita: muy buen sabor y terneza.
•	Arañita: riquísima, con un sabor ahumado muy logrado.

La ensalada de kale estaba muy sabrosa y las papas fritas realmente destacan: tranquilamente podrían competir en un top 10 de Buenos Aires.

De postre pedimos los tres que había y todos aprobaron. El panqueque split fue mi favorito.

Un detalle: en una mesa cercana alguien se prendió un porro. Creo que ahí falló un poco el control del personal o del encargado para pedir que lo fume afuera.

En total pedimos:
2 entradas, 3 carnes, 3 acompañamientos, 3 postres y 2 vinos.
El total terminó siendo unos $70k por persona. (Eramos 5)

A ese nivel de precio hoy hay bastante competencia, así que no estoy seguro de si volvería, aunque la comida estuvo muy bien","2026-03-06T03:09:36.671Z","Ignacio makar","9","false","https://www.google.com/maps/reviews/data=!4m8!14m7!1m6!2m5!1sCi9DQUlRQUNvZENodHljRjlvT21samFXRmphVk50VVZKWlZXNXRWRGw2TVhkS09XYxAB!2m1!1s0x0:0x83f734f0120baca0!3m1!1s2@1:CAIQACodChtycF9oOmljaWFjaVNtUVJZVW5tVDl6MXdKOWc%7C%7C?hl=es-419","https://www.google.com/maps/contrib/101757637017842100593?hl=es-419",,,"es","0",
"Restaurante Parrilla Maravilla","3","Muy rica la comida. Nada asombroso, simple.
Muy buenas papas fritas y cortes de carne bien logrados.
La atención floja, si bien los chicos hacen lo que pueden, se nota que faltan manos.
Ambiente muy ruidoso.","2026-03-06T02:24:25.983Z","Franco Peretti","6","false","https://www.google.com/maps/reviews/data=!4m8!14m7!1m6!2m5!1sCi9DQUlRQUNvZENodHljRjlvT21wQlZXMXRWbWxKYVZCNmRIUmlWWEZ4YjBWaVgxRRAB!2m1!1s0x0:0x83f734f0120baca0!3m1!1s2@1:CAIQACodChtycF9oOmpBVW1tVmlJaVB6dHRiVXFxb0ViX1E%7C%7C?hl=es-419","https://www.google.com/maps/contrib/112133024860498740530?hl=es-419",,,"es","0",
"Restaurante Parrilla Maravilla","4","Muy rico, nada deslumbrante. Una parrilla con buenas carnes y guarniciones pero nada que sea particularmente destacable.
Buena variedad de vinos (desde 13800) y entradas!
Los dumplings y las papas fritas me gustaron mucho.
La ambientación es todo
Me sorprendio el panqueque de banana con ddl, muy bueno. El tiramisu y tarta de manzana no destacaron, estaban ok.
Gastamos 35000 c/u","2026-03-05T01:48:26.342Z","Josefina Staudenmaier","254","true","https://www.google.com/maps/reviews/data=!4m8!14m7!1m6!2m5!1sCi9DQUlRQUNvZENodHljRjlvT21OSGVEZzRka2sxTVdSUlVVUkhVelZpYzJ4R00xRRAB!2m1!1s0x0:0x83f734f0120baca0!3m1!1s2@1:CAIQACodChtycF9oOmNHeDg4dkk1MWRRUURHUzVic2xGM1E%7C%7C?hl=es-419","https://www.google.com/maps/contrib/109079847369468909889?hl=es-419",,,"es","0",
"Restaurante Parrilla Maravilla","5",,"2026-03-04T22:18:23.115Z","FB","230","true","https://www.google.com/maps/reviews/data=!4m8!14m7!1m6!2m5!1sCi9DQUlRQUNvZENodHljRjlvT2pWRGQzSmZjRVpsTkdOa09XeFNSbEZWUjFSTVJVRRAB!2m1!1s0x0:0x83f734f0120baca0!3m1!1s2@1:CAIQACodChtycF9oOjVDd3JfcEZlNGNkOWxSRlFVR1RMRUE%7C%7C?hl=es-419","https://www.google.com/maps/contrib/100587295251639634427?hl=es-419",,,,"0",
"Restaurante Parrilla Maravilla","5","Me gustó mucho el lugar, la ambientación, el servicio, te traen una cerveza de cortesía y entrada de pan con un dip. Pedimos la empanada que estaba tremenda, la stracciatela con morrones me sorprendió, pedimos una Marucha por recomendación de la casa, muy exquisita pero no era para compartir, las papas tremendas y el panqueque de banana muy bueno! Volvería, no es económico.","2026-03-04T02:01:27.941Z","Giuliana Corbellini","94","true","https://www.google.com/maps/reviews/data=!4m8!14m7!1m6!2m5!1sCi9DQUlRQUNvZENodHljRjlvT21kUWJXNVVOV3R4YlhGWWNFdFBkRGh5Y1ZsTldFRRAB!2m1!1s0x0:0x83f734f0120baca0!3m1!1s2@1:CAIQACodChtycF9oOmdQbW5UNWtxbXFYcEtPdDhycVlNWEE%7C%7C?hl=es-419","https://www.google.com/maps/contrib/110135618754182485759?hl=es-419",,,"es","0",
"Restaurante Parrilla Maravilla","5",,"2026-03-02T04:11:17.838Z","Agustina Galarza","8","false","https://www.google.com/maps/reviews/data=!4m8!14m7!1m6!2m5!1sCi9DQUlRQUNvZENodHljRjlvT25kUUxURlpNa0ZMTlZsVWJ5MXFibWRRVm1kT1dsRRAB!2m1!1s0x0:0x83f734f0120baca0!3m1!1s2@1:CAIQACodChtycF9oOndQLTFZMkFLNVlUby1qbmdQVmdOWlE%7C%7C?hl=es-419","https://www.google.com/maps/contrib/100369060702465393857?hl=es-419",,,,"0",
"Restaurante Parrilla Maravilla","5","Impecable. La carne de las mejores que probé en caba. Las alitas increibles, el pickle de apio una locura!

El lugar es muy bonito, volveria mil veces","2026-02-28T14:15:56.039Z","Camila Godi","16","true","https://www.google.com/maps/reviews/data=!4m8!14m7!1m6!2m5!1sCi9DQUlRQUNvZENodHljRjlvT20xUmNrWnhUWGN4VFdOeFUyNDBRVjlxYm1rellXYxAB!2m1!1s0x0:0x83f734f0120baca0!3m1!1s2@1:CAIQACodChtycF9oOm1RckZxTXcxTWNxU240QV9qbmkzYWc%7C%7C?hl=es-419","https://www.google.com/maps/contrib/116061513877198117882?hl=es-419",,,"es","0",
"Restaurante Parrilla Maravilla","3","Don't believe the hype. I've been to so many parrillas here in BA, and the food here is average.

Cool vibe, good service, great wine. Very average food.

No seasoning on the meat. Awful salad dressing. ""Buffalo Wings"" are not buffalo wings - no spice whatsoever.

Over priced for what it is.","2026-02-28T12:03:18.493Z","Lawrence Ward","40","true","https://www.google.com/maps/reviews/data=!4m8!14m7!1m6!2m5!1sCi9DQUlRQUNvZENodHljRjlvT21Gd1puQlFkM1pVU0Y4MmFHbE9NamgwYUdoR2QxRRAB!2m1!1s0x0:0x83f734f0120baca0!3m1!1s2@1:CAIQACodChtycF9oOmFwZnBQd3ZUSF82aGlOMjh0aGhGd1E%7C%7C?hl=es-419","https://www.google.com/maps/contrib/107322243675478818586?hl=es-419",,,"en","0",
"Restaurante Parrilla Maravilla","3","Mucho bla menú común limitado  la carne medio pelo   nada se destacó el lugar lindo y los que atienden buena onda buen servicio no volvería","2026-02-27T05:23:40.193Z","Cecilia da rocha","264","true","https://www.google.com/maps/reviews/data=!4m8!14m7!1m6!2m5!1sCi9DQUlRQUNvZENodHljRjlvT2xsdVluaGxia2Q0UVZsbU1VRnpWVWx6U1c1NFRsRRAB!2m1!1s0x0:0x83f734f0120baca0!3m1!1s2@1:CAIQACodChtycF9oOlluYnhlbkd4QVlmMUFzVUlzSW54TlE%7C%7C?hl=es-419","https://www.google.com/maps/contrib/110560915975086252308?hl=es-419",,,"es","0",
"Restaurante Parrilla Maravilla","4","Muy rico y nos atendieron super bien!","2026-02-26T03:01:09.521Z","Agustin Prieto","12","false","https://www.google.com/maps/reviews/data=!4m8!14m7!1m6!2m5!1sCi9DQUlRQUNvZENodHljRjlvT2xjMlIwOW9RWFZVZVdWSmJWaHZPRUo0V0dOMmEyYxAB!2m1!1s0x0:0x83f734f0120baca0!3m1!1s2@1:CAIQACodChtycF9oOlc2R09oQXVUeWVJbVhvOEJ4WGN2a2c%7C%7C?hl=es-419","https://www.google.com/maps/contrib/102916597001625925636?hl=es-419",,,"es","0",
"Restaurante Parrilla Maravilla","5","Espectacular muy buen ambience","2026-02-25T12:46:28.053Z","Ada Baez","14","false","https://www.google.com/maps/reviews/data=!4m8!14m7!1m6!2m5!1sCi9DQUlRQUNvZENodHljRjlvT21SUWJIaExUVUk1VUhOMVNWcGtaMFIzWjJwcVRFRRAB!2m1!1s0x0:0x83f734f0120baca0!3m1!1s2@1:CAIQACodChtycF9oOmRQbHhLTUI5UHN1SVpkZ0R3Z2pqTEE%7C%7C?hl=es-419","https://www.google.com/maps/contrib/102222305166367113080?hl=es-419",,,"es","0",
"Restaurante Parrilla Maravilla","4","Beautiful restaurant with very good service , food good but not excellent and overpriced.","2026-02-21T15:54:47.678Z","Anders Helander","170","true","https://www.google.com/maps/reviews/data=!4m8!14m7!1m6!2m5!1sCi9DQUlRQUNvZENodHljRjlvT2tkdlgxWlRTSEp6ZVhaRGIxODFRblIzWkY5QmExRRAB!2m1!1s0x0:0x83f734f0120baca0!3m1!1s2@1:CAIQACodChtycF9oOkdvX1ZTSHJzeXZDb181QnR3ZF9Ba1E%7C%7C?hl=es-419","https://www.google.com/maps/contrib/111694304891290315481?hl=es-419",,,"en","0",
"Restaurante Parrilla Maravilla","4","Si, me olvidé, no tengo fotos!
Pero, merece reseña, merece un MARAVILLOSO ;-) comentario.
Por fuera no (me) vende, pero al cruzar la puerta de entrada, cambió mi idea de parrillonga de Palermo que pensé que estábamos yendo, por una más boutique, más chic (tampoco tanto, eh!).
Mesas adentro y un patio con plantas muy lindo! Sin duda, yo no elegiría comer adentro estando el patio con clima agradable. El patio y su presentación es realmente atractivo y acogedor.
Muy buena la atención de todos los mozos
De cortesía una Quilmes tirada!
Un panera que me resultó extraña para una parrilla. Eramos dos y en una bandejita trajeron una fugacita de manteca (de las chiquitas!) con una talita (grisín retorcido), si, 1 de cada uno para los dos (nada grave :) ).
Las empanadas de asado, cortadas a mano y fritas......un despelote. Muy ricas, cos salsa toque dulzón y carne deliciosa.
Muy rico el chorizo, y el principal, una Marucha que estuvo excelente. Corte que hace mucho tiempo no comía y me resultó muuuuy satisfactorio.
Acompañamos con un vinito (tienen una cava a la vista con precios de los vinos claramente indicados) rosado, una papas fritas provenzal que al menos tenías dos cocciones y estaban muy crocantes por fuera y suaves por dentro.
El postre, un panqueque de DDL (el nombre era más palermitano que el que yo le estoy asignando) . Un par de aguas con gas acompañando.
Superó expectativas. Volveré sin dudas. Recomiendo reservar (a las 20.30 explotaba). Ahhhhhhhhhh...precio, no son de parrillonga, no son excesivos.......Justos. Tuvimos 10% por efectivo.","2026-02-18T13:17:18.690Z","Martin Goldsman “Marto”","120","true","https://www.google.com/maps/reviews/data=!4m8!14m7!1m6!2m5!1sCi9DQUlRQUNvZENodHljRjlvT2twQ01VUnRjR3Q2TVRSbVFVOWxNRmR6Ym5sMFRtYxAB!2m1!1s0x0:0x83f734f0120baca0!3m1!1s2@1:CAIQACodChtycF9oOkpCMURtcGt6MTRmQU9lMFdzbnl0Tmc%7C%7C?hl=es-419","https://www.google.com/maps/contrib/107957873931371142471?hl=es-419",,,"es","0",
"Restaurante Parrilla Maravilla","1","Pésimo desde la puerta que no te abren
El que te lleva a la mesa ni te dice dónde es
Pedi una Marucha$60000 daleeee
Vino con puré frío
Mandé a cocinar la Maru hs por que estaba cruda y cuando volvió después de media hora volvió también el puré frío
Obvio no pedimos helado y nos fuimos
También cuando me fui nadie me dijo chau ni me abrieron la puerta
Puro bla bla bla
Nunca más vuelvo","2026-02-17T21:33:26.816Z","adriano df","62","true","https://www.google.com/maps/reviews/data=!4m8!14m7!1m6!2m5!1sCi9DQUlRQUNvZENodHljRjlvT2s5UVJuQTFORlZIVmpSMVNXZFRSazFLYVdaRVIwRRAB!2m1!1s0x0:0x83f734f0120baca0!3m1!1s2@1:CAIQACodChtycF9oOk9QRnA1NFVHVjR1SWdTRk1KaWZER0E%7C%7C?hl=es-419","https://www.google.com/maps/contrib/101137830246365613391?hl=es-419",,,"es","0",
"Restaurante Parrilla Maravilla","5","Ya fuimos tres veces, es increíble todo. Se nota cuando le ponen amor a los lugares, es precioso. El detalle de recibirte con una cerveza me fascinó. La tira de asado increíble y la atención de todos los camareros siempre es espectacular.","2026-02-17T20:20:13.121Z","Génesis Rodríguez","127","true","https://www.google.com/maps/reviews/data=!4m8!14m7!1m6!2m5!1sCi9DQUlRQUNvZENodHljRjlvT2pOWk1tTjNjVFZEVDJJMk9EZElWRmd5U2s1R1prRRAB!2m1!1s0x0:0x83f734f0120baca0!3m1!1s2@1:CAIQACodChtycF9oOjNZMmN3cTVDT2I2ODdIVFgySk5GZkE%7C%7C?hl=es-419","https://www.google.com/maps/contrib/107723086185645270083?hl=es-419",,,"es","0",
"Restaurante Parrilla Maravilla","5","Se volvió una de mis parrillas preferidas. Increíble la comida, muy linda la ambientación y excelente atención.","2026-02-16T00:07:51.792Z","Mariana Serra Zamora","22","true","https://www.google.com/maps/reviews/data=!4m8!14m7!1m6!2m5!1sCi9DQUlRQUNvZENodHljRjlvT2tkaWFGVk1YM2g1UjFneVpHcFBOa0ZyWHpJd09WRRAB!2m1!1s0x0:0x83f734f0120baca0!3m1!1s2@1:CAIQACodChtycF9oOkdiaFVMX3h5R1gyZGpPNkFrXzIwOVE%7C%7C?hl=es-419","https://www.google.com/maps/contrib/115992033349749978646?hl=es-419",,,"es","0",
"Restaurante Parrilla Maravilla","5","Super recomendable. No es una parrilla clásica. La hamburguesa genial, las papas buenisimas, las empanadas también. Buenos vinos y lugar ambiente lindo sobre todo en partio.","2026-02-15T20:06:48.313Z","Gui","69","true","https://www.google.com/maps/reviews/data=!4m8!14m7!1m6!2m5!1sCi9DQUlRQUNvZENodHljRjlvT2xoNVRVUmhTVlpMT1c4NGRWUkNkbDlVTVVscUxYYxAB!2m1!1s0x0:0x83f734f0120baca0!3m1!1s2@1:CAIQACodChtycF9oOlh5TURhSVZLOW84dVRCdl9UMUlqLXc%7C%7C?hl=es-419","https://www.google.com/maps/contrib/105955551806226569375?hl=es-419",,,"es","0",
"Restaurante Parrilla Maravilla","5","Excelente Parilla Maravilla, resctaron un local/espacio que era hermoso y lo rehabilitaron para un restaurante parrilla.

La comida 10 puntos: probamos la arañita (sabor increíble), las papas fritas (las mejores que probé) y los morrones con stracciatella (gran reemplazo a una ensalada normal).

👎🏻 Únicos puntos flojos:
- Cobran cubierto.
- AQA la cobran por cada vez que te sirven.
- La acústica del patio no es la mejor.","2026-02-15T17:48:19.709Z","Héctor 'Tito' Dubon","330","true","https://www.google.com/maps/reviews/data=!4m8!14m7!1m6!2m5!1sCi9DQUlRQUNvZENodHljRjlvT2kxVFFUQXlWMk10VUZjNE9ISjFlR3hyVkhSNFRIYxAB!2m1!1s0x0:0x83f734f0120baca0!3m1!1s2@1:CAIQACodChtycF9oOi1TQTAyV2MtUFc4OHJ1eGxrVHR4THc%7C%7C?hl=es-419","https://www.google.com/maps/contrib/105958669863059950273?hl=es-419",,,"es","0",
"Restaurante Parrilla Maravilla","5","Muy bueno el asado hacia mucho que no comía un corte de ese nivel.ancho, jugoso,tierno y con un gusto muy bien logrado.
También comimos arañita riquísima acompañado con fritas provenzal y arroz con huevo 👍🔥🔥💪","2026-02-15T17:46:21.138Z","Ricardo Intorno","56","true","https://www.google.com/maps/reviews/data=!4m8!14m7!1m6!2m5!1sCi9DQUlRQUNvZENodHljRjlvT21kdFdtWkVlRkpIVEZCcFRYaDVUa1F5TFVoblEwRRAB!2m1!1s0x0:0x83f734f0120baca0!3m1!1s2@1:CAIQACodChtycF9oOmdtWmZEeFJHTFBpTXh5TkQyLUhnQ0E%7C%7C?hl=es-419","https://www.google.com/maps/contrib/112037149603206325794?hl=es-419",,,"es","0",
"Restaurante Parrilla Maravilla","5","El lugar es hermoso.
La atención es buenisima. Tienen una cava con precios para que te pares a elegir el vino que me gustó mucho, también te dan de cortesía una cerveza tirada.
Todo lo que pedimos estuvo riquísimo, empanadas, tira de asado, ensalada de kale (posta muy rica) y papas fritas.
Me encantó, volveré","2026-02-15T14:23:18.655Z","Belen Napoli Lawaisse","11","true","https://www.google.com/maps/reviews/data=!4m8!14m7!1m6!2m5!1sCi9DQUlRQUNvZENodHljRjlvT2tvelRGaE9ZMjFYWm5KcVgwOXhOR3R6U25KeGEwRRAB!2m1!1s0x0:0x83f734f0120baca0!3m1!1s2@1:CAIQACodChtycF9oOkozTFhOY21XZnJqX09xNGtzSnJxa0E%7C%7C?hl=es-419","https://www.google.com/maps/contrib/114892045916214085753?hl=es-419",,,"es","0",
"Restaurante Parrilla Maravilla","5","Buenismo el lugar y la atención. La comida espectacular","2026-02-14T17:14:18.492Z","Lucas Meilan","53","true","https://www.google.com/maps/reviews/data=!4m8!14m7!1m6!2m5!1sCi9DQUlRQUNvZENodHljRjlvT2w5Uk1rMXhNak10U3prNFJGUjJVVGRYTXpNMlJGRRAB!2m1!1s0x0:0x83f734f0120baca0!3m1!1s2@1:CAIQACodChtycF9oOl9RMk1xMjMtSzk4RFR2UTdXMzM2RFE%7C%7C?hl=es-419","https://www.google.com/maps/contrib/107334393961135050631?hl=es-419",,,"es","0",
"Restaurante Parrilla Maravilla","5","Excelente la comida, el lugar es muy canchero, el jardín es muy acogedor y los chicos que atienden son muy atentos y amables.","2026-02-12T14:45:49.382Z","Flore Franck","72","true","https://www.google.com/maps/reviews/data=!4m8!14m7!1m6!2m5!1sCi9DQUlRQUNvZENodHljRjlvT2pSeVZrVmlYelUxTVZwS1lXZEJhRVZSUWpKbGNYYxAB!2m1!1s0x0:0x83f734f0120baca0!3m1!1s2@1:CAIQACodChtycF9oOjRyVkViXzU1MVpKYWdBaEVRQjJlcXc%7C%7C?hl=es-419","https://www.google.com/maps/contrib/112295228998930822121?hl=es-419",,,"es","0",
"Restaurante Parrilla Maravilla","4","Buena calidad de productos y atención. El lugar tiene su onda. Volvería","2026-02-12T14:32:38.730Z","Marcelo Gerpe","268","true","https://www.google.com/maps/reviews/data=!4m8!14m7!1m6!2m5!1sCi9DQUlRQUNvZENodHljRjlvT21acFZHTXlTbUZSUzBSZk9GcFBWVjlHTmxreU0yYxAB!2m1!1s0x0:0x83f734f0120baca0!3m1!1s2@1:CAIQACodChtycF9oOmZpVGMySmFRS0RfOFpPVV9GNlkyM2c%7C%7C?hl=es-419","https://www.google.com/maps/contrib/103660719628201292019?hl=es-419",,,"es","0",
"Restaurante Parrilla Maravilla","5","Tope de gama.
Marucha 10/10.","2026-02-09T15:43:58.685Z","Kevin Cabuli","15","true","https://www.google.com/maps/reviews/data=!4m8!14m7!1m6!2m5!1sCi9DQUlRQUNvZENodHljRjlvT2xoNWNIbFdaVzAzY1U1dlVGSnJiWFE0YmpjMk4zYxAB!2m1!1s0x0:0x83f734f0120baca0!3m1!1s2@1:CAIQACodChtycF9oOlh5cHlWZW03cU5vUFJrbXQ4bjc2N3c%7C%7C?hl=es-419","https://www.google.com/maps/contrib/117036353067046936947?hl=es-419",,,"ja","0",
"Restaurante Parrilla Maravilla","5","Muy buena la atención. El lugar es súper relajado!","2026-02-08T14:21:18.244Z","Fernando Arbach","39","true","https://www.google.com/maps/reviews/data=!4m8!14m7!1m6!2m5!1sCi9DQUlRQUNvZENodHljRjlvT2pKM1QxQnJSa2xQVld4bU1uWTJNekJYY3pOaFozYxAB!2m1!1s0x0:0x83f734f0120baca0!3m1!1s2@1:CAIQACodChtycF9oOjJ3T1BrRklPVWxmMnY2MzBXczNhZ3c%7C%7C?hl=es-419","https://www.google.com/maps/contrib/110883239890745332774?hl=es-419",,,"es","0",
"Restaurante Parrilla Maravilla","5","Muy rico!","2026-02-01T21:02:38.189Z","Julieta Galvez","16","true","https://www.google.com/maps/reviews/data=!4m8!14m7!1m6!2m5!1sCi9DQUlRQUNvZENodHljRjlvT2pFMk9IVXdOSGd5VGtRNVp6Rk1UekJJVms5RmJsRRAB!2m1!1s0x0:0x83f734f0120baca0!3m1!1s2@1:CAIQACodChtycF9oOjE2OHUwNHgyTkQ5ZzFMTzBIVk9FblE%7C%7C?hl=es-419","https://www.google.com/maps/contrib/113459044559287381559?hl=es-419",,,"es","0",
"Restaurante Parrilla Maravilla","5","Hermoso lugar y la comida espectacular. Recomiendo para cualquier fanático de la buena gastronomía que quiera descansar en un ambiente relajado.","2026-02-01T17:52:42.043Z","Agustina Ralle","3","false","https://www.google.com/maps/reviews/data=!4m8!14m7!1m6!2m5!1sCi9DQUlRQUNvZENodHljRjlvT2tkZlYwbzJRamxXZFhKTWNscEZWMDFTYUY5M1dGRRAB!2m1!1s0x0:0x83f734f0120baca0!3m1!1s2@1:CAIQACodChtycF9oOkdfV0o2QjlWdXJMclpFV01SaF93WFE%7C%7C?hl=es-419","https://www.google.com/maps/contrib/115318403310064756194?hl=es-419",,,"es","0",
"Restaurante Parrilla Maravilla","5","Increíble. Pedimos los dumplings y la arañita y todo de 10.

El servicio y el ambiente super ameno y calido. Muy recomendable para venir un mediodia","2026-02-01T17:51:59.238Z","Gonzalo Sueiro","7","false","https://www.google.com/maps/reviews/data=!4m8!14m7!1m6!2m5!1sCi9DQUlRQUNvZENodHljRjlvT2s5RGFrWkdVbFJNTjJSWmIyVmhOa1JOZERsT04yYxAB!2m1!1s0x0:0x83f734f0120baca0!3m1!1s2@1:CAIQACodChtycF9oOk9DakZGUlRMN2RZb2VhNkRNdDlON2c%7C%7C?hl=es-419","https://www.google.com/maps/contrib/114403920128586257642?hl=es-419",,,"es","0",
"Restaurante Parrilla Maravilla","5",,"2026-02-01T14:31:29.451Z","Maria Miel Griguoli","13","false","https://www.google.com/maps/reviews/data=!4m8!14m7!1m6!2m5!1sCi9DQUlRQUNvZENodHljRjlvT2xkc1NuZGhTMWRpTTFWSmRtcEJNRzlMZFRaTFNFRRAB!2m1!1s0x0:0x83f734f0120baca0!3m1!1s2@1:CAIQACodChtycF9oOldsSndhS1diM1VJdmpBMG9LdTZLSEE%7C%7C?hl=es-419","https://www.google.com/maps/contrib/112042467190918081391?hl=es-419",,,,"0",
"Restaurante Parrilla Maravilla","5","La atención personalizada fue lo destacado de la noche, nos explicaron los platos y vinos. Recomiendo para ir a cenar en pareja o con amigos. Gran ambiente","2026-01-25T21:04:27.535Z","Agostina Sammarco","12","true","https://www.google.com/maps/reviews/data=!4m8!14m7!1m6!2m5!1sCi9DQUlRQUNvZENodHljRjlvT21Wb2EwMUxhV3QxV0doRVFuQmplbWRUUWtGaVJVRRAB!2m1!1s0x0:0x83f734f0120baca0!3m1!1s2@1:CAIQACodChtycF9oOmVoa01LaWt1WGhEQnBjemdTQkFiRUE%7C%7C?hl=es-419","https://www.google.com/maps/contrib/104004660267136183571?hl=es-419",,,"es","0",
"Restaurante Parrilla Maravilla","5",,"2026-01-25T15:42:40.415Z","Martin Hoffman","42","true","https://www.google.com/maps/reviews/data=!4m8!14m7!1m6!2m5!1sCi9DQUlRQUNvZENodHljRjlvT2pSc1ZXTjFkak16V0dJMmJuVlRSakptVVZSek9HYxAB!2m1!1s0x0:0x83f734f0120baca0!3m1!1s2@1:CAIQACodChtycF9oOjRsVWN1djMzWGI2bnVTRjJmUVRzOGc%7C%7C?hl=es-419","https://www.google.com/maps/contrib/110147270213376054416?hl=es-419",,,,"0",
"Restaurante Parrilla Maravilla","5","Excelente restaurant, una carta acotada que funciona! Con excelente servicio, buena comida y precios muy acordes! La tira banderita con ensalada es 💙","2026-01-25T04:04:04.629Z","Joely Lara","43","true","https://www.google.com/maps/reviews/data=!4m8!14m7!1m6!2m5!1sCi9DQUlRQUNvZENodHljRjlvT2tOQlZtaHJZbUkyZGpSQlFuTkpWSHAxWjB4M1lVRRAB!2m1!1s0x0:0x83f734f0120baca0!3m1!1s2@1:CAIQACodChtycF9oOkNBVmhrYmI2djRBQnNJVHp1Z0x3YUE%7C%7C?hl=es-419","https://www.google.com/maps/contrib/100927122931785601821?hl=es-419",,,"es","0",
"Restaurante Parrilla Maravilla","5","Muy buen lugar!

Pedimos Crudo, Pescado curado, vinagreta, pickles. Excelente !

Buffalo wings ricas pero difíciles de comer no las volvería a pedir

Morcilla excelente
Arañita muy buena

Papas fritas re mal educadas. Una cosa de locos

Gastamos 80 dólares con vino y postre","2026-01-24T03:06:56.744Z","Fabio Lubnicki","108","true","https://www.google.com/maps/reviews/data=!4m8!14m7!1m6!2m5!1sCi9DQUlRQUNvZENodHljRjlvT2pOQ2VVOHphRlJCVjBaU00xRlNWM0ppVjJSS1dFRRAB!2m1!1s0x0:0x83f734f0120baca0!3m1!1s2@1:CAIQACodChtycF9oOjNCeU8zaFRBV0ZSM1FSV3JiV2RKWEE%7C%7C?hl=es-419","https://www.google.com/maps/contrib/110904773945719372389?hl=es-419",,,"es","0",
"Restaurante Parrilla Maravilla","3","Parrilla Maravilla propone una estética moderna y cuidada, tanto en el interior como en el patio, que se aleja de la imagen tradicional de la parrilla porteña.

La experiencia fue ágil desde el inicio: teníamos reserva y nos asignaron la mesa ni bien llegamos. Lo mismo ocurrió con la comida, que llegó en un máximo de 15 minutos. Pedimos una porción de asado banderita, papas fritas y ensalada de lechuga.

La carne estuvo muy bien lograda: jugosa y en su punto justo de sal. Se trata de una tira de asado de buena calidad, dentro del estándar esperado para una buena parrilla. Las papas fritas acompañaron muy bien, con doble cocción y una ejecución correcta.
La ensalada, en cambio, fue el punto más flojo: si bien tenía buena presentación, le faltó un dressing que unificara y elevara los sabores. A nuestro parecer, evitable.

De postre, frutillas con crema: una propuesta interesante, con un sutil toque herbal que aportó frescura sin resultar invasivo.

Como gesto, ofrecieron cervezas de cortesía 🙂.

El gasto fue de $120.000, sin tomar vino, un precio que se percibe algo elevado en relación con la propuesta gastronómica.

En síntesis, Parrilla Maravilla es un espacio atractivo, lindo y bien ejecutado, con una experiencia correcta y con margen de mejora en el menú para alinearse con el valor que propone. Es una nueva apertura y, aun así, consideramos que tiene todo para que le vaya muy bien.","2026-01-24T01:32:15.259Z","Lucia Nanni","49","true","https://www.google.com/maps/reviews/data=!4m8!14m7!1m6!2m5!1sCi9DQUlRQUNvZENodHljRjlvT21wbllUQTViME55Y1ZwUE9HWnVTV3hWYzB4SVltYxAB!2m1!1s0x0:0x83f734f0120baca0!3m1!1s2@1:CAIQACodChtycF9oOmpnYTA5b0NycVpPOGZuSWxVc0xIYmc%7C%7C?hl=es-419","https://www.google.com/maps/contrib/109891195272827846756?hl=es-419",,,"es","0",
"Restaurante Parrilla Maravilla","5","Wow! What a great restaurant! Excellent food - great service! One thing to note - they have many more wines than are on the menu! Ask to see the wine fridges and they’ll help you pick something special!

We sat outside and celebrated a birthday! My only suggestion is to turn the music down a little outside as it was difficult to hear each other. And that meant some tables had to yell at each other! Ha! A small thing to mention but otherwise they would have received a perfect rating!","2026-01-23T01:20:16.887Z","dave michayluk","42","true","https://www.google.com/maps/reviews/data=!4m8!14m7!1m6!2m5!1sCi9DQUlRQUNvZENodHljRjlvT21nMFdHaHBTMnhJZVZKUWNtVlZiMFpaZWtGMFYyYxAB!2m1!1s0x0:0x83f734f0120baca0!3m1!1s2@1:CAIQACodChtycF9oOmg0WGhpS2xIeVJQcmVVb0ZZekF0V2c%7C%7C?hl=es-419","https://www.google.com/maps/contrib/103130832375985067445?hl=es-419",,,"en","0",
"Restaurante Parrilla Maravilla","5","Muy hermoso espacio, con comidas y vinos ricos.","2026-01-22T23:32:29.471Z","Brandon Davis","31","true","https://www.google.com/maps/reviews/data=!4m8!14m7!1m6!2m5!1sCi9DQUlRQUNvZENodHljRjlvT2xWWE5FVjNNbkpNV0d0cE1HWmFSRUpEZFhKcVVtYxAB!2m1!1s0x0:0x83f734f0120baca0!3m1!1s2@1:CAIQACodChtycF9oOlVXNEV3MnJMWGtpMGZaREJDdXJqUmc%7C%7C?hl=es-419","https://www.google.com/maps/contrib/104008334485972926069?hl=es-419",,,"es","0",
"Restaurante Parrilla Maravilla","5","La ambientacion copadisima, los mozos unos tipazos y la comida es excelente.","2026-01-19T15:13:51.654Z","Ramiro Mendez","23","true","https://www.google.com/maps/reviews/data=!4m8!14m7!1m6!2m5!1sCi9DQUlRQUNvZENodHljRjlvT25keVRFbHpVMUZFV0RaeGJVNWFTRXBOWmt0R2NXYxAB!2m1!1s0x0:0x83f734f0120baca0!3m1!1s2@1:CAIQACodChtycF9oOndyTElzU1FEWDZxbU5aSEpNZktGcWc%7C%7C?hl=es-419","https://www.google.com/maps/contrib/105876208644879908244?hl=es-419",,,"es","0",
